{
  "status": "planned",
  "version": 1,
  "aspect_ratio": "16:9",
  "layout_mode": "no_presenter",
  "scenes": [
    {
      "scene_id": "S03",
      "aspect_ratio": "16:9",
      "layout_mode": "no_presenter",
      "parent_module_id": "M01",
      "text_slots": {
        "【主标题】": "流程变模板",
        "【输入】": "重复任务",
        "【处理动作】": "录制流程",
        "【处理说明】": "转成可复用步骤",
        "【输出结果】": "Skill 清单",
        "【记住这句话】": "先跑小样再复用"
      },
      "micro_components": [
        {
          "component_id": "C01",
          "anchor": "input_port",
          "phase": "load",
          "instance_count": 1,
          "text_slots": {
            "【参数名】": "输入",
            "【参数值】": "流程"
          }
        },
        {
          "component_id": "C03",
          "anchor": "payload_track",
          "phase": "process",
          "instance_count": 2,
          "text_slots": {
            "【数据名】": "步骤",
            "【数据值】": "整理"
          }
        },
        {
          "component_id": "C08",
          "anchor": "status_mount",
          "phase": "process",
          "instance_count": 1,
          "text_slots": {
            "【状态】": "处理中"
          }
        },
        {
          "component_id": "C27",
          "anchor": "result_mount",
          "phase": "resolve",
          "instance_count": 1,
          "text_slots": {
            "【指标】": "复用",
            "【结果值】": "可执行"
          }
        },
        {
          "component_id": "C30",
          "anchor": "summary_mount",
          "phase": "hold",
          "instance_count": 1,
          "text_slots": {
            "【结论】": "先小样再复用"
          }
        }
      ],
      "transition_in": "TR04",
      "transition_out": "TR06"
    }
  ]
}
